{
  "$schema": "./media-provenance.schema.json",
  "schemaVersion": 1,
  "policy": "all-public-media-enumerated",
  "updatedAt": "2026-07-16",
  "scope": "Every public raster image, vector image, animation, or video in the documented release surface.",
  "legalBoundary": "This is a maintainer provenance declaration, not a legal opinion or trademark-clearance report. Dependencies, platforms, and referenced third parties retain their own rights.",
  "assets": [
    {
      "path": "docs/assets/readme-hero.svg",
      "sha256": "0e6a26999d4741d0cb3329cc812393b7c569d1d4833ec37db99c65bc1dd78526",
      "mediaType": "image/svg+xml",
      "origin": "repository-authored",
      "author": "Frontend Design Ultra maintainers",
      "source": "Original vector artwork authored for the Frontend Design Ultra repository README.",
      "license": "MIT",
      "redistribution": "allowed",
      "modification": "allowed",
      "thirdPartyMaterial": false,
      "reviewedAt": "2026-07-16",
      "claimBoundary": "Repository identity artwork only; it is not an award mark, certification, customer logo, or benchmark result."
    },
    {
      "path": "docs/assets/showcase/ecommerce.webp",
      "sha256": "f4a529bb716c698a9c2772054f2a020a75aed3e7fb4873e0aa99b8c16404b1f0",
      "mediaType": "image/webp",
      "origin": "render-of-repository-authored",
      "author": "Frontend Design Ultra maintainers",
      "source": "Playwright render of original showcase route /ecommerce/; generated from repository-authored code, SVG/CSS visuals, and fictional calibration facts.",
      "license": "MIT",
      "redistribution": "allowed",
      "modification": "allowed",
      "thirdPartyMaterial": false,
      "reviewedAt": "2026-07-16",
      "claimBoundary": "Curated calibration-showcase render only; not a blind benchmark result, customer outcome, award score, accessibility certificate, or trademark-clearance opinion."
    },
    {
      "path": "docs/assets/showcase/finance.webp",
      "sha256": "bdaba02edca6a18265a3bc9332dbf4a7fbdc9bdf84318bcd7eab1ffcc47cd97f",
      "mediaType": "image/webp",
      "origin": "render-of-repository-authored",
      "author": "Frontend Design Ultra maintainers",
      "source": "Playwright render of original showcase route /finance/; generated from repository-authored code, SVG/CSS visuals, and fictional calibration facts.",
      "license": "MIT",
      "redistribution": "allowed",
      "modification": "allowed",
      "thirdPartyMaterial": false,
      "reviewedAt": "2026-07-16",
      "claimBoundary": "Curated calibration-showcase render only; not a blind benchmark result, customer outcome, award score, accessibility certificate, or trademark-clearance opinion."
    },
    {
      "path": "docs/assets/showcase/healthcare.webp",
      "sha256": "9b0cd0ba53e4178a41b91c29d7ca7dfe10f89270be5c3f219d835e465df97328",
      "mediaType": "image/webp",
      "origin": "render-of-repository-authored",
      "author": "Frontend Design Ultra maintainers",
      "source": "Playwright render of original showcase route /healthcare/; generated from repository-authored code, SVG/CSS visuals, and fictional calibration facts.",
      "license": "MIT",
      "redistribution": "allowed",
      "modification": "allowed",
      "thirdPartyMaterial": false,
      "reviewedAt": "2026-07-16",
      "claimBoundary": "Curated calibration-showcase render only; not a blind benchmark result, customer outcome, award score, accessibility certificate, or trademark-clearance opinion."
    },
    {
      "path": "docs/assets/showcase/hospitality-entrance-storyboard.webp",
      "sha256": "55e3034e6f1e95fbbb45117ec2cb58d20ce87da444a7a8a18330ab358447f978",
      "mediaType": "image/webp",
      "origin": "render-of-repository-authored",
      "author": "Frontend Design Ultra maintainers",
      "source": "Playwright render of original showcase route /hospitality/; generated from repository-authored code, SVG/CSS visuals, and fictional calibration facts.",
      "license": "MIT",
      "redistribution": "allowed",
      "modification": "allowed",
      "thirdPartyMaterial": false,
      "reviewedAt": "2026-07-16",
      "claimBoundary": "Curated calibration-showcase render only; not a blind benchmark result, customer outcome, award score, accessibility certificate, or trademark-clearance opinion."
    },
    {
      "path": "docs/assets/showcase/hospitality.webp",
      "sha256": "234323434527fdf1f829883e01ce667f179e5d737376087e1c82bf445eab0a7d",
      "mediaType": "image/webp",
      "origin": "render-of-repository-authored",
      "author": "Frontend Design Ultra maintainers",
      "source": "Playwright render of original showcase route /hospitality/; generated from repository-authored code, SVG/CSS visuals, and fictional calibration facts.",
      "license": "MIT",
      "redistribution": "allowed",
      "modification": "allowed",
      "thirdPartyMaterial": false,
      "reviewedAt": "2026-07-16",
      "claimBoundary": "Curated calibration-showcase render only; not a blind benchmark result, customer outcome, award score, accessibility certificate, or trademark-clearance opinion."
    },
    {
      "path": "docs/assets/showcase/legal.webp",
      "sha256": "10a9f77152d3582fd44d58ec9a8d2db94993f6b7e8aea6ffb38c548973fda4f6",
      "mediaType": "image/webp",
      "origin": "render-of-repository-authored",
      "author": "Frontend Design Ultra maintainers",
      "source": "Playwright render of original showcase route /legal/; generated from repository-authored code, SVG/CSS visuals, and fictional calibration facts.",
      "license": "MIT",
      "redistribution": "allowed",
      "modification": "allowed",
      "thirdPartyMaterial": false,
      "reviewedAt": "2026-07-16",
      "claimBoundary": "Curated calibration-showcase render only; not a blind benchmark result, customer outcome, award score, accessibility certificate, or trademark-clearance opinion."
    },
    {
      "path": "docs/assets/showcase/saas.webp",
      "sha256": "4765fe95a9b24a583c4a33e3347a761b6aa30513e870008d3ebaec9d0aba81ac",
      "mediaType": "image/webp",
      "origin": "render-of-repository-authored",
      "author": "Frontend Design Ultra maintainers",
      "source": "Playwright render of original showcase route /saas/; generated from repository-authored code, SVG/CSS visuals, and fictional calibration facts.",
      "license": "MIT",
      "redistribution": "allowed",
      "modification": "allowed",
      "thirdPartyMaterial": false,
      "reviewedAt": "2026-07-16",
      "claimBoundary": "Curated calibration-showcase render only; not a blind benchmark result, customer outcome, award score, accessibility certificate, or trademark-clearance opinion."
    },
    {
      "path": "showcase/app/icon.svg",
      "sha256": "d8fecce8b5ac6c1fd66ad0240b50fce0bba73d9c890fb8a52dcdb53a399c4b95",
      "mediaType": "image/svg+xml",
      "origin": "repository-authored",
      "author": "Frontend Design Ultra maintainers",
      "source": "Original vector application icon authored for the local multi-industry showcase.",
      "license": "MIT",
      "redistribution": "allowed",
      "modification": "allowed",
      "thirdPartyMaterial": false,
      "reviewedAt": "2026-07-16",
      "claimBoundary": "Calibration-showcase icon only; it does not represent a registered commercial brand or third-party endorsement."
    }
  ]
}
